qid;sexp;query
0;(VALUE (37201 (MSR A019380 (WHERE (DIM TC 1992JJ00) (DIM GC GM0361)))));hoeveel kinderen waren het 3e kind in het gezin in 1992 in Alkmaar
0;(VALUE (37201 (MSR A019380 (WHERE (DIM TC 1992JJ00) (DIM GC GM0361)))));hoeveel kinderen waren het derde kind in het gezin in 1992 in Alkmaar?
1;(VALUE (37201 (MSR D000128_8 (WHERE (DIM GC GM1723)))));aantal kinderen geboren in Alphen-Chaam
1;(VALUE (37201 (MSR D000128_8 (WHERE (DIM GC GM1723)))));geboortes in Alphen-Chaam
2;(VALUE (37201 (MSR D000128_6 (WHERE (DIM TC 1992JJ00)))));aantal kinderen geboren in 1992
2;(VALUE (37201 (MSR D000128_6 (WHERE (DIM TC 1992JJ00)))));aantal geboortes in 1992
2;(VALUE (37201 (MSR D000128_6 (WHERE (DIM TC 1992JJ00)))));hoeveel geborenen 1992
3;(VALUE (37201 (MSR D000128_6 (WHERE (DIM GC PV29) (DIM TC 2015JJ00)))));kinderen geboren in zeeland 2015
3;(VALUE (37201 (MSR D000128_6 (WHERE (DIM GC PV29) (DIM TC 2015JJ00)))));hoeveel geboortes in 2015 in zeeland
4;(VALUE (37201 (MSR 70900 (WHERE (DIM GC GM0060) (DIM TC 2009JJ00)))));40-jarige moeders op Ameland 2009
5;(VALUE (37201 (MSR 4000 (WHERE (DIM TC 2003JJ00)))));geboren meisjes 2003
5;(VALUE (37201 (MSR 4000 (WHERE (DIM TC 2003JJ00)))));aantal meisjes geboren in 2003
6;(VALUE (37201 (MSR 21100 (WHERE (DIM GC GM0888) (DIM TC 2016JJ00)))));moeders ouder dan 45 in Beek in 2016
6;(VALUE (37201 (MSR 21100 (WHERE (DIM GC GM0888) (DIM TC 2016JJ00)))));48-jarige moeders in Beek (Limburg) in 2016
7;(VALUE (37201 (MSR A019381 (WHERE (DIM TC 2016JJ00) (DIM GC PV24)))));geboorte 4e of meer kind in Flevoland 2016
7;(VALUE (37201 (MSR A019381 (WHERE (DIM TC 2016JJ00) (DIM GC PV24)))));geboortes vierde kind in het gezin Flevoland 2016
8;(VALUE (37201 (MSR M004931 (WHERE (DIM GC GM0060)))));vruchtbaarheidscijfer ameland
8;(VALUE (37201 (MSR M004931 (WHERE (DIM GC GM0060)))));gestandaardiseerd vruchtbaarheidscijfer op ameland
9;(VALUE (37201 (MSR D000128_2 (WHERE (DIM TC 2014JJ00)))));aantal geboren kinderen per inwoner 2014
9;(VALUE (37201 (MSR D000128_2 (WHERE (DIM TC 2014JJ00)))));relatief aantal geboortes 2014
10;(VALUE (37201 (MSR 70600 (WHERE (DIM GC GM0739)))));26-jarige moeders in Aarle-Rixtel
10;(VALUE (37201 (MSR 70600 (WHERE (DIM GC GM0739)))));28-jarige moeders in Aarle Rixtel
11;(VALUE (37201 (MSR A019379 (WHERE (DIM GC GM0206)))));aantal 2e kinderen in Bemmel
12;(VALUE (37201 (MSR 1010 (WHERE (DIM TC 1988JJ00)))));geboortes bij ongehuwde moeders in 1988
13;(VALUE (37201 (MSR D000128_1 (WHERE (DIM GC CR40)))));geboortes in de corop Flevoland
13;(VALUE (37201 (MSR D000128_1 (WHERE (DIM GC CR40)))));geboren kinderen in Flevoland
14;(VALUE (37201 (MSR 3000 (WHERE (DIM TC 2018JJ00) (DIM GC GM0889)))));aantal geboren jongens in Beesel 2018
14;(VALUE (37201 (MSR 3000 (WHERE (DIM TC 2018JJ00) (DIM GC GM0889)))));geboortes jongetjes Beesel in 2018
15;(VALUE (37201 (MSR A019380 (WHERE (DIM GC GM0142)))));aantal kinderen 3e kind in het gezin in Ambt Delden
15;(VALUE (37201 (MSR A019380 (WHERE (DIM GC GM0142)))));aantal kinderen derde kind in het gezin in Ambt Delden
16;(VALUE (37201 (MSR D000128_4 (WHERE (DIM TC 1992JJ00) (DIM GC PV31)))));aantal geboortes in Limburg in 1992
16;(VALUE (37201 (MSR D000128_4 (WHERE (DIM TC 1992JJ00) (DIM GC PV31)))));hoeveel kinderen zijn er in 1992 in Limburg geboren
17;(VALUE (37201 (MSR 4000 (WHERE (DIM TC 2007JJ00) (DIM GC PV31)))));hoeveel meisjes zijn er in Limburg geboren in 2007
17;(VALUE (37201 (MSR 4000 (WHERE (DIM TC 2007JJ00) (DIM GC PV31)))));aantal geboortes meisjes 2007 Limburg
18;(VALUE (37201 (MSR M004931 (WHERE (DIM GC GM0480) (DIM TC 1996JJ00)))));vruchtbaarheidscijfer in Ter Aar 1996
18;(VALUE (37201 (MSR M004931 (WHERE (DIM GC GM0480) (DIM TC 1996JJ00)))));gestandaardiseerd vruchtbaarheidscijfer in 1996 in Ter Aar
19;(VALUE (37201 (MSR 70700 (WHERE (DIM TC 2010JJ00) (DIM GC LD02)))));aantal 30 jarige moeders in oost nederland in 2010
19;(VALUE (37201 (MSR 70700 (WHERE (DIM TC 2010JJ00) (DIM GC LD02)))));aantal moeders tussen de 30 en 35 in oost-nederland 2010
20;(VALUE (37296ned (MSR A008188_1 (WHERE (DIM TC 2010JJ00)))));Overige Westerse migranten in 2010
21;(VALUE (37296ned (MSR D000110_2 (WHERE (DIM TC 1984JJ00)))));demografische druk in 1984
21;(VALUE (37296ned (MSR D000110_2 (WHERE (DIM TC 1984JJ00)))));wat was de totale demografische druk in 1984
22;(VALUE (37296ned (MSR A008187_3 (WHERE (DIM TC 2005JJ00)))));2e generatie niet westerse migranten in 2005
23;(VALUE (37296ned (MSR 70501_1 (WHERE (DIM TC 1973JJ00)))));aantal twintigers in 1973
23;(VALUE (37296ned (MSR 70501_1 (WHERE (DIM TC 1973JJ00)))));hoeveel dertigers waren er in 1973
24;(VALUE (37296ned (MSR H008766_2 (WHERE (DIM TC 2019JJ00)))));hoeveel eerste generatie turken waren er in 2019
25;(VALUE (37296ned (MSR 1050 (WHERE (DIM TC 2004JJ00)))));aantal verweduwde personen in 2004
25;(VALUE (37296ned (MSR 1050 (WHERE (DIM TC 2004JJ00)))));hoeveel weduwen waren er in 2004
26;(VALUE (37296ned (MSR H008766_2 (WHERE (DIM TC 2008JJ00)))));hoeveel 1e generatie turken in 2008
26;(VALUE (37296ned (MSR H008766_2 (WHERE (DIM TC 2008JJ00)))));aantal eerste generatie turken in 2008
27;(VALUE (37296ned (MSR 4000_2 (WHERE (DIM TC 2016JJ00)))));wat was de gemiddelde leeftijd van vrouwen in 2016
27;(VALUE (37296ned (MSR 4000_2 (WHERE (DIM TC 2016JJ00)))));leeftijd vrouwen 2016
28;(VALUE (37296ned (MSR M000114 (WHERE (DIM TC 2014JJ00)))));gemiddelde huishoudensgrootte in 2014
28;(VALUE (37296ned (MSR M000114 (WHERE (DIM TC 2014JJ00)))));hoe groot was een gezin in 2014
29;(VALUE (37296ned (MSR M000114 (WHERE (DIM TC 2015JJ00)))));grootte van huishouden in 2015
29;(VALUE (37296ned (MSR M000114 (WHERE (DIM TC 2015JJ00)))));hoeveel personen per huishouden in 2015
30;(VALUE (37296ned (MSR 53950_2 (WHERE (DIM TC 2018JJ00)))));hoeveel bejaarden in 2018
30;(VALUE (37296ned (MSR 53950_2 (WHERE (DIM TC 2018JJ00)))));welk percentage was senioren in 2018
30;(VALUE (37296ned (MSR 53950_2 (WHERE (DIM TC 2018JJ00)))));relatief aantal 65 plussers in 2018
31;(VALUE (37296ned (MSR M000244_1 (WHERE (DIM TC 2008JJ00)))));migratie saldo 2008
31;(VALUE (37296ned (MSR M000244_1 (WHERE (DIM TC 2008JJ00)))));migratiesaldo 2008
32;(VALUE (37296ned (MSR M000100 (WHERE (DIM TC 1995JJ00)))));bevolkingsdichtheid 1995
32;(VALUE (37296ned (MSR M000100 (WHERE (DIM TC 1995JJ00)))));wat was de dichtheid van de bevolking in 1995
33;(VALUE (37296ned (MSR M000244_2 (WHERE (DIM TC 2006JJ00)))));relatief migratiesaldo in 2006
33;(VALUE (37296ned (MSR M000244_2 (WHERE (DIM TC 2006JJ00)))));relatief migratie saldo 2006
34;(VALUE (37296ned (MSR M001497 (WHERE (DIM TC 2016JJ00)))));aantal overige correcties in 2016
35;(VALUE (37296ned (MSR D000116 (WHERE (DIM TC 2019JJ00)))));grijze druk op de bevolking in 2019
36;(VALUE (37296ned (MSR M000167 (WHERE (DIM TC 1976JJ00)))));aantal immigranten in 1976
36;(VALUE (37296ned (MSR M000167 (WHERE (DIM TC 1976JJ00)))));hoeveel immigranten waren er in 1976
37;(VALUE (37296ned (MSR 1016010 (WHERE (DIM TC 1976JJ00)))));aantal huishoudens van meerdere personen in 1976
38;(VALUE (37296ned (MSR 41400_1 (WHERE (DIM TC 2020JJ00)))));aantal jongeren 2020
38;(VALUE (37296ned (MSR 41400_1 (WHERE (DIM TC 2020JJ00)))));hoeveel tieners in 2020
38;(VALUE (37296ned (MSR 41400_1 (WHERE (DIM TC 2020JJ00)))));personen jonger dan 20 in 2020
39;(VALUE (37296ned (MSR M000101_2 (WHERE (DIM TC 1988JJ00)))));wat was de totale bevolkingsgroei in 1988
39;(VALUE (37296ned (MSR M000101_2 (WHERE (DIM TC 1988JJ00)))));bevolkingsgroei 1988
40;(VALUE (37296ned (MSR M000100 (WHERE (DIM TC 1994JJ00)))));bevolkingsdichtheid 1994
40;(VALUE (37296ned (MSR M000100 (WHERE (DIM TC 1994JJ00)))));wat was de bevolkingsdichtheid in 1994
41;(VALUE (37296ned (MSR A008188_1 (WHERE (DIM TC 2003JJ00)))));overig westerse migranten in 2003
42;(VALUE (37296ned (MSR H007936_1 (WHERE (DIM TC 2010JJ00)))));migranten uit spanje in 2010
42;(VALUE (37296ned (MSR H007936_1 (WHERE (DIM TC 2010JJ00)))));migranten uit italië in 2010
42;(VALUE (37296ned (MSR H007936_1 (WHERE (DIM TC 2010JJ00)))));hoeveel migranten uit griekenland in 2010
42;(VALUE (37296ned (MSR H007936_1 (WHERE (DIM TC 2010JJ00)))));hoeveel migranten uit portugal in 2010
43;(VALUE (37296ned (MSR M000244_2 (WHERE (DIM TC 1986JJ00)))));relatief migratiesaldo in 1986
43;(VALUE (37296ned (MSR M000244_2 (WHERE (DIM TC 1986JJ00)))));relatief migratie saldo 1986
44;(VALUE (37296ned (MSR H008766_1 (WHERE (DIM TC 2010JJ00)))));aantal turkse migranten in 2010
45;(VALUE (37296ned (MSR 53950_1 (WHERE (DIM TC 1980JJ00)))));aantal 65-plussers in 1980
45;(VALUE (37296ned (MSR 53950_1 (WHERE (DIM TC 1980JJ00)))));aantal 70-jarigen in 1980
46;(VALUE (37296ned (MSR 2013357_2 (WHERE (DIM TC 2020JJ00)))));hoeveel 2e generatie migranten in 2020
46;(VALUE (37296ned (MSR 2013357_2 (WHERE (DIM TC 2020JJ00)))));hoeveel tweede generatie migranten waren er in 2020
47;(VALUE (37296ned (MSR T001038_2 (WHERE (DIM TC 1966JJ00)))));totale bevolking in 1966
47;(VALUE (37296ned (MSR T001038_2 (WHERE (DIM TC 1966JJ00)))));grootte van de bevolking in 1966
48;(VALUE (37296ned (MSR A008188_3 (WHERE (DIM TC 2020JJ00)))));aantal overig westerse migranten van de 2e generatie in 2020
49;(VALUE (37296ned (MSR A008187_1 (WHERE (DIM TC 2018JJ00)))));aantal overig niet westerse migranten in 2018
49;(VALUE (37296ned (MSR A008187_1 (WHERE (DIM TC 2018JJ00)))));aantal overig niet-westerse migranten in 2018
50;(VALUE (37422ned (MSR 3000_2 (WHERE (DIM TC 1970JJ00)))));aantal geboren jongens ten opzichte van aantal meisjes in 1970
50;(VALUE (37422ned (MSR 3000_2 (WHERE (DIM TC 1970JJ00)))));verhouding geboortes tussen jongetjes en meisjes 1970
51;(VALUE (37422ned (MSR D003488_1 (WHERE (DIM TC 1963JJ00)))));hoeveel doodgeboren kinderen na een zwangerschap van 28 weken of meer in 1963
52;(VALUE (37422ned (MSR 70900 (WHERE (DIM TC 1991JJ00)))));hoeveel 43-jarigen kregen een kind in 1991
52;(VALUE (37422ned (MSR 70900 (WHERE (DIM TC 1991JJ00)))));hoeveel geboortes waren er bij  moeders van 40 tot 45 jaar in 1991
53;(VALUE (37422ned (MSR D003482 (WHERE (DIM TC 1960JJ00)))));hoeveel tweelingen met een van elk geslacht zijn er geboren in 1960
53;(VALUE (37422ned (MSR D003482 (WHERE (DIM TC 1960JJ00)))));hoeveel tweelingen met 1 jongen en 1 meisje zijn er geboren in 1960
53;(VALUE (37422ned (MSR D003482 (WHERE (DIM TC 1960JJ00)))));jongen meisje tweeling 1996
54;(VALUE (37422ned (MSR D003488_1 (WHERE (DIM TC 1987JJ00)))));aantal doodgeboren kinderen na zwangerschap van 28 weken of meer in 1987
55;(VALUE (37422ned (MSR 41400 (WHERE (DIM TC 1986JJ00)))));aantal tienermoeders in 1986
55;(VALUE (37422ned (MSR 41400 (WHERE (DIM TC 1986JJ00)))));hoeveel geboortes bij moeders onder de 20 in 1986
56;(VALUE (37422ned (MSR 70700 (WHERE (DIM TC 1975JJ00)))));hoeveel vrouwen tussen de 30 en 35 zijn bevallen in 1975
57;(VALUE (37422ned (MSR D000128_6 (WHERE (DIM TC 2005JJ00)))));aantal geboren kinderen in 2005
57;(VALUE (37422ned (MSR D000128_6 (WHERE (DIM TC 2005JJ00)))));hoeveel kinderen zijn er in 2005 geboren
58;(VALUE (37422ned (MSR D003488_2 (WHERE (DIM TC 1950JJ00)))));hoeveel kinderen zijn er dood geboren na 28 weken in 1950 relatief gezien
59;(VALUE (37422ned (MSR D003496 (WHERE (DIM TC 1951JJ00)))));hoeveel vrouwen hebben gemiddeld genomen 3 kinderen in 1951
60;(VALUE (37422ned (MSR A025238_2 (WHERE (DIM TC 1961JJ00)))));hoeveel meerlingen zijn er in 1961 geboren
60;(VALUE (37422ned (MSR A025238_2 (WHERE (DIM TC 1961JJ00)))));hoeveel geboortes met meer dan een kind waren er in 1961
61;(VALUE (37422ned (MSR D000128_8 (WHERE (DIM TC 1964JJ00)))));aantal geboortes in 1964
62;(VALUE (37422ned (MSR 41400 (WHERE (DIM TC 2005JJ00)))));hoeveel moeders jonger dan 20 waren er in 2005
63;(VALUE (37422ned (MSR D000128_8 (WHERE (DIM TC 1968JJ00)))));hoeveel kinderen zijn er in 1968 geboren
64;(VALUE (37422ned (MSR 1020 (WHERE (DIM TC 1997JJ00)))));hoeveel gehuwde vrouwen hebben kinderen gebaard in 1997
65;(VALUE (37422ned (MSR 70800 (WHERE (DIM TC 2010JJ00)))));hoeveel moeders tussen de 35 en 40 jaar in 2010
66;(VALUE (37422ned (MSR D003483 (WHERE (DIM TC 1988JJ00)))));hoeveel tweelingen met 2 jongens zijn er geboren in 1988
66;(VALUE (37422ned (MSR D003483 (WHERE (DIM TC 1988JJ00)))));aantal geboren tweelingen met twee jongens in 1988
67;(VALUE (37422ned (MSR D000128_8 (WHERE (DIM TC 1996JJ00)))));totaal geboortes in 1996
68;(VALUE (37422ned (MSR D000128_8 (WHERE (DIM TC 1994JJ00)))));totaal aantal levend geboren kinderen in 1994
69;(VALUE (37422ned (MSR D000128_6 (WHERE (DIM TC 2019JJ00)))));hoeveel kinderen zijn er levend geboren in 2019
70;(VALUE (37772ned (MSR 3000_2 (WHERE (DIM TC 1968JJ00)))));hoeveel mannen zijn er in 1968 getrouwd
70;(VALUE (37772ned (MSR 3000_2 (WHERE (DIM TC 1968JJ00)))));aantal huwende mannen in 1968
71;(VALUE (37772ned (MSR 1010_6 (WHERE (DIM TC 1952JJ00)))));wat was de gemiddelde leeftijd van eerder ongehuwde vrouwen bij hun huwelijk in 1952
72;(VALUE (37772ned (MSR 3000_6 (WHERE (DIM TC 1963JJ00)))));welke leeftijd hadden mannen gemiddeld bij huwelijken in 1963
73;(VALUE (37772ned (MSR 1050_6 (WHERE (DIM TC 1981JJ00)))));hoe oud waren verweduwde vrouwen bij hun huwelijk in 1981
74;(VALUE (37772ned (MSR 4000_4 (WHERE (DIM TC 1989JJ00)))));hoeveel vrouwen zijn er in 1989 in het huwelijk getreden
74;(VALUE (37772ned (MSR 4000_4 (WHERE (DIM TC 1989JJ00)))));hoeveel vrouwen zijn er in 1989 getrouwd
74;(VALUE (37772ned (MSR 4000_4 (WHERE (DIM TC 1989JJ00)))));aantal huwelijken vrouwen 1989
75;(VALUE (37772ned (MSR 1010_4 (WHERE (DIM TC 1964JJ00)))));hoeveel ongehuwde vrouwen zijn er in 1964 getrouwd
76;(VALUE (37772ned (MSR 1050_1 (WHERE (DIM TC 1985JJ00)))));hoeveel verweduwde mannen zijn erin 1985 getrouwd
76;(VALUE (37772ned (MSR 1050_1 (WHERE (DIM TC 1985JJ00)))));huwelijken van weduwnaren in 1985
77;(VALUE (37772ned (MSR D003634_2 (WHERE (DIM TC 2008JJ00)))));aantal vrouwen met minimaal 2 huwelijken in 2008
77;(VALUE (37772ned (MSR D003634_2 (WHERE (DIM TC 2008JJ00)))));hoeveel vrouwen in 2008 zijn minimaal 2 keer getrouwd
78;(VALUE (37772ned (MSR T001221_1 (WHERE (DIM TC 1958JJ00)))));hoeveel huwelijken zijn er voltrokken in 1958
78;(VALUE (37772ned (MSR T001221_1 (WHERE (DIM TC 1958JJ00)))));totaal huwelijken 1958
79;(VALUE (37772ned (MSR 4000_2 (WHERE (DIM TC 1961JJ00)))));hoeveel vrouwen zijn erin 1961 getrouwd
79;(VALUE (37772ned (MSR 4000_2 (WHERE (DIM TC 1961JJ00)))));totaal aantal huwelijken vrouwen in 1961
80;(VALUE (37772ned (MSR 1010_2 (WHERE (DIM TC 1993JJ00)))));hoeveel ongehuwde vrouwen zijn er in 1993 getrouwd
81;(VALUE (37772ned (MSR D003634_1 (WHERE (DIM TC 2016JJ00)))));hoeveel mannen in 2016 waren minimaal 2 keer getrouwd
82;(VALUE (37772ned (MSR 3000_6 (WHERE (DIM TC 2017JJ00)))));wat was de gemiddelde leeftijd van mannen huwelijkssluitingen in 2017
83;(VALUE (37772ned (MSR 1010_1 (WHERE (DIM TC 1997JJ00)))));hoeveel eerder ongehuwde mannen zijn er in 1997 getrouwd
84;(VALUE (37772ned (MSR 3000_6 (WHERE (DIM TC 1957JJ00)))));hoe oud waren mannen bij huwelijken in 1957
85;(VALUE (37772ned (MSR A028295_1 (WHERE (DIM TC 2015JJ00)))));hoeveel vrouwen zijn er in 2015 getrouwd met een vrouw
85;(VALUE (37772ned (MSR A028295_1 (WHERE (DIM TC 2015JJ00)))));aantal lesbische huwelijken in 2015
85;(VALUE (37772ned (MSR A028295_1 (WHERE (DIM TC 2015JJ00)))));aantal huwelijkssluitingen tussen vrouwen in 2015
86;(VALUE (37772ned (MSR 4000_6 (WHERE (DIM TC 2021JJ00)))));op welke gemiddelde leeftijd zijn vrouwen getrouwd in 2021
87;(VALUE (37772ned (MSR 1080_4 (WHERE (DIM TC 2016JJ00)))));hoeveel gescheiden vrouwen zijn er in 2016 getrouwd
88;(VALUE (37772ned (MSR D003634_2 (WHERE (DIM TC 1993JJ00)))));hoeveel vrouwen in 1993 zijn minimaal 2 keer getrouwd
89;(VALUE (37772ned (MSR 1080_5 (WHERE (DIM TC 1981JJ00)))));op welke leeftijd zijn gescheiden mannen in 1981 getrouwd
90;(VALUE (37789ksz (MSR D000192 (WHERE (DIM TC 2006MM12)))));hoeveel anw uitkerningen zijn erin december 2006 uitgegeven
91;(VALUE (37789ksz (MSR 90210 (WHERE (DIM TC 2001MM10)))));hoeveel mensen tot aow leeftijd hadden in oktober 2001 een bijstandsuitkering
92;(VALUE (37789ksz (MSR D007076_2 (WHERE (DIM TC 2018MM01)))));aantal werkloosheidsuitkeringen in januari van 2018
93;(VALUE (37789ksz (MSR 90210 (WHERE (DIM TC 2020MM10)))));hoeveel bijstandsuitkeringen tot aow leeftijd waren er in oktober 2020
94;(VALUE (37789ksz (MSR D000287 (WHERE (DIM TC 1999MM01)))));hoeveel mensen kregen een wao uitkering in januari 1999
94;(VALUE (37789ksz (MSR D000287 (WHERE (DIM TC 1999MM01)))));hoeveel mensen kregen een wao-uitkering in januari 1999
95;(VALUE (37789ksz (MSR D000194 (WHERE (DIM TC 2016MM06)))));hoeveel aow uitkeringen zijn er in juni 2016 uitgegeven
95;(VALUE (37789ksz (MSR D000194 (WHERE (DIM TC 2016MM06)))));hoeveel aow-uitkeringen zijn er in juni 2016 uitgegeven
96;(VALUE (37789ksz (MSR D000192 (WHERE (DIM TC 1999JJ00)))));aantal anw-uitkeringen 1999
97;(VALUE (37789ksz (MSR D000194 (WHERE (DIM TC 2009MM12)))));aantal aow-uitkeringen december 2009
97;(VALUE (37789ksz (MSR D000194 (WHERE (DIM TC 2009MM12)))));hoeveel aow uitkeringen zijn er uitgegeven in december 2009
98;(VALUE (37789ksz (MSR D000288 (WHERE (DIM TC 2007MM07)))));waz uitkeringen juli 2007
99;(VALUE (37789ksz (MSR D000235 (WHERE (DIM TC 2020MM11)))));iow-uitkeringen november 2020
100;(VALUE (37789ksz (MSR 90210 (WHERE (DIM TC 2010MM02)))));bijstandsuitkeringen tot aow leeftijd februari 2010
101;(VALUE (37789ksz (MSR D000288 (WHERE (DIM TC 2011JJ00)))));hoeveel mensen kregen een waz uitkering in 2011
102;(VALUE (37789ksz (MSR D000198_2 (WHERE (DIM TC 2008MM06)))));totaal aantal arbeidsongeschiktheidsuitkeringen in juni 2008
103;(VALUE (37789ksz (MSR 90200 (WHERE (DIM TC 2005JJ00)))));totaal aantal bijstandsuitkeringen vanaf aow leeftijd in 2005
104;(VALUE (37789ksz (MSR D000192 (WHERE (DIM TC 2005MM09)))));hoeveel anw uitkeringen in september van 2005
105;(VALUE (37789ksz (MSR D000192 (WHERE (DIM TC 1999JJ00)))));hoeveel anw-uitkeringen in 1999
106;(VALUE (37789ksz (MSR D000288 (WHERE (DIM TC 1998MM08)))));aantal waz-uitkeringen in augustus 1998
107;(VALUE (37789ksz (MSR D000233 (WHERE (DIM TC 2012MM11)))));aantal uitgegeven ioaw uitkeringen in november 2012
108;(VALUE (37789ksz (MSR D000235 (WHERE (DIM TC 2016JJ00)))));hoeveel iow uitkeringen in 2016
109;(VALUE (37789ksz (MSR D000236 (WHERE (DIM TC 2015MM06)))));iva uitkeringen in juni van 2015
110;(VALUE (37979ned (MSR M000181_2 (WHERE (DIM Geslacht 3000) (DIM TC 2009JJ00)))));relatief aantal zuigelingensterfte onder jongens in 2009
110;(VALUE (37979ned (MSR M000181_2 (WHERE (DIM Geslacht 3000) (DIM TC 2009JJ00)))));relatieve zuigelingensterfte mannen in 2009
111;(VALUE (37979ned (MSR M000180 (WHERE (DIM TC 2008JJ00) (DIM Geslacht 3000)))));levensverwachting van mannen bij geboorte in 2008
111;(VALUE (37979ned (MSR M000180 (WHERE (DIM TC 2008JJ00) (DIM Geslacht 3000)))));wat was de levensverwachting bij mannen in 2008
112;(VALUE (37979ned (MSR M000181_1 (WHERE (DIM Geslacht T001038) (DIM TC 1985JJ00)))));zuigelingenstrefte in 1985
112;(VALUE (37979ned (MSR M000181_1 (WHERE (DIM Geslacht T001038) (DIM TC 1985JJ00)))));wat was de totale zuigelingensterfte in 1985
113;(VALUE (37979ned (MSR M000180 (WHERE (DIM Geslacht 3000)))));levensverwachting van mannen bij geboorte
113;(VALUE (37979ned (MSR M000180 (WHERE (DIM Geslacht 3000)))));wat was de levensverwachting bij mannen
114;(VALUE (37979ned (MSR M000181_2 (WHERE (DIM Geslacht T001038)))));relatieve zuigelingensterfte totaal
114;(VALUE (37979ned (MSR M000181_2 (WHERE (DIM Geslacht T001038)))));totale relatieve zuigelingensterfte
115;(VALUE (37979ned (MSR M003619_1 (WHERE (DIM TC 2009JJ00) (DIM Geslacht 3000)))));overleden jongetjes binnen maand na geboorte in 2009
115;(VALUE (37979ned (MSR M003619_1 (WHERE (DIM TC 2009JJ00) (DIM Geslacht 3000)))));overleden jongens binnen 4 weken na geboorte in 2009
116;(VALUE (37979ned (MSR M003503 (WHERE (DIM Geslacht 3000) (DIM TC 1977JJ00)))));leeftijd bij overlijden van mannen in 1977
117;(VALUE (37979ned (MSR M000181_2 (WHERE (DIM Geslacht 4000)))));relatief aantal zuigelingensterfte onder meisjes
117;(VALUE (37979ned (MSR M000181_2 (WHERE (DIM Geslacht 4000)))));relatieve zuigelingensterfte meisjes
117;(VALUE (37979ned (MSR M000181_2 (WHERE (DIM Geslacht 4000)))));relatieve zuigelingensterfte vrouwen
118;(VALUE (37979ned (MSR M000181_1 (WHERE (DIM Geslacht T001038)))));totale zuigelingensterfte
119;(VALUE (37979ned (MSR M003503 (WHERE (DIM Geslacht T001038) (DIM TC 2005JJ00)))));gemiddelde leeftijd bij overlijden
119;(VALUE (37979ned (MSR M003503 (WHERE (DIM Geslacht T001038) (DIM TC 2005JJ00)))));leeftijd overledenen
120;(VALUE (37979ned (MSR M000181_2 (WHERE (DIM Geslacht 4000)))));relatieve zuigelingensterfte bij meisjes
121;(VALUE (37979ned (MSR M000134_2 (WHERE (DIM Geslacht 4000)))));relatief aantal overleden vrouwen
121;(VALUE (37979ned (MSR M000134_2 (WHERE (DIM Geslacht 4000)))));hoeveel vrouwen zijn er relatief overlednen
122;(VALUE (37979ned (MSR M000134_1 (WHERE (DIM TC 1975JJ00) (DIM Geslacht T001038)))));totaal aantal overledenen in 1975
122;(VALUE (37979ned (MSR M000134_1 (WHERE (DIM TC 1975JJ00) (DIM Geslacht T001038)))));hoeveel mensen zijn er in 1975 overleden
123;(VALUE (37979ned (MSR M003618 (WHERE (DIM TC 1965JJ00)))));gestandaardiseerd aantal overledenen in 1965
124;(VALUE (37979ned (MSR M000181_1 (WHERE (DIM TC 1956JJ00) (DIM Geslacht T001038)))));totale zuigelingensterfte in 1956
125;(VALUE (37979ned (MSR M003618 (WHERE (DIM Geslacht T001038)))));totaal aantal gestandaardiseerd overledenen
126;(VALUE (37979ned (MSR M000181_1 (WHERE (DIM TC 1981JJ00)))));zuigelingensterfte in 1981
127;(VALUE (37979ned (MSR D005088_1 (WHERE (DIM TC 2018JJ00)))));perinatale sterfte na 24 weken in 2018
128;(VALUE (37979ned (MSR M000134_2 (WHERE (DIM Geslacht 3000)))));relatief overlijden van mannen
128;(VALUE (37979ned (MSR M000134_2 (WHERE (DIM Geslacht 3000)))));relatief aantal overleden mannen
129;(VALUE (37979ned (MSR D005089_2 (WHERE (DIM Geslacht T001038)))));perinatale sterfte na 28 weken relatief
130;(VALUE (70072ned (MSR M003003 (WHERE (DIM TC 2004JJ00) (DIM GC PV24)))));aantal nieuwbouwwoningen in flevoland in 2004
130;(VALUE (70072ned (MSR M003003 (WHERE (DIM TC 2004JJ00) (DIM GC PV24)))));hoeveel nieuwbouwwoningen zijn er in flevoland in 2004 gebouwd
131;(VALUE (70072ned (MSR A045823_3 (WHERE (DIM TC 2015JJ00) (DIM GC PV20)))));hoeveel bos was er in de provincie groningen in 2005
132;(VALUE (70072ned (MSR A028984 (WHERE (DIM TC 2002JJ00) (DIM GC PV26)))));hoeveel schapen waren er in utrecht in 2002
132;(VALUE (70072ned (MSR A028984 (WHERE (DIM TC 2002JJ00) (DIM GC PV26)))));hoeveel schapen waren er in de provincie utrecht in 2002
133;(VALUE (70072ned (MSR A028988 (WHERE (DIM GC PV25) (DIM TC 2002JJ00)))));hoeveel paarden waren er in gelderland in 2002
133;(VALUE (70072ned (MSR A028988 (WHERE (DIM GC PV25) (DIM TC 2002JJ00)))));hoeveel pony's waren er in gelderland in 2002
134;(VALUE (70072ned (MSR 1016030_2 (WHERE (DIM GC PV26) (DIM TC 2015JJ00)))));hoeveel gezinnen met kinderen woonden er relatief gezien in de provincie utrecht in 2015
134;(VALUE (70072ned (MSR 1016030_2 (WHERE (DIM GC PV26) (DIM TC 2015JJ00)))));hoeveel gezinnen met kinderen woonden er relatief gezien in utrecht in 2015
135;(VALUE (70072ned (MSR A047041 (WHERE (DIM GC PV22)))));welke percentage van drenthe bestaat uit gras
135;(VALUE (70072ned (MSR A047041 (WHERE (DIM GC PV22)))));hoeveel gras is er in drenthe
136;(VALUE (70072ned (MSR T001455_3 (WHERE (DIM GC PV23)))));wat is de totale oppervlakte van overijssel
136;(VALUE (70072ned (MSR T001455_3 (WHERE (DIM GC PV23)))));hoe groot is overijssel
137;(VALUE (70072ned (MSR A029002 (WHERE (DIM TC 2006JJ00)))));hoeveel overig pluimvee was er in 2006
138;(VALUE (70072ned (MSR A047043 (WHERE (DIM GC PV20) (DIM TC 2021JJ00)))));hoeveel tijdelijk grasland was er in de provincie groningen in 2021
139;(VALUE (70072ned (MSR D000110_2 (WHERE (DIM TC 2010JJ00)))));wat was de totale demografische druk in 2010
140;(VALUE (70072ned (MSR 70300_1 (WHERE (DIM TC 2012JJ00) (DIM GC LD03)))));hoeveel 11 jarigen waren er in west nederland in 2012
140;(VALUE (70072ned (MSR 70300_1 (WHERE (DIM TC 2012JJ00) (DIM GC LD03)))));hoeveel tieners waren er in west-nederland in 2012
141;(VALUE (70072ned (MSR A045814_2 (WHERE (DIM TC 1996JJ00) (DIM GC PV20)))));hoeveel recreatieterrein was er in 1996 in de provincie groningen
142;(VALUE (70072ned (MSR 383105 (WHERE (DIM TC 2015JJ00)))));hoeveel communicatiebedrijven waren er in 2015
142;(VALUE (70072ned (MSR 383105 (WHERE (DIM TC 2015JJ00)))));hoeveel bedrijfsvestigingen in de vervoerssector waren er in 2015
142;(VALUE (70072ned (MSR 383105 (WHERE (DIM TC 2015JJ00)))));bedrijven vervoer 2015
143;(VALUE (70072ned (MSR T001455_3 (WHERE (DIM TC 1997JJ00)))));wat was de totale oppervlakte in 1997
144;(VALUE (70072ned (MSR A048262 (WHERE (DIM TC 2012JJ00)))));van hoeveel procent van de woningen in 2012 was de eigenaar onbekend
145;(VALUE (70072ned (MSR 70300_1 (WHERE (DIM GC LD04)))));hoeveel tieners zijn er in zuid-nederland
145;(VALUE (70072ned (MSR 70300_1 (WHERE (DIM GC LD04)))));hoeveel 13-jarigen zijn er in zuid nederland
146;(VALUE (70072ned (MSR A045814_3 (WHERE (DIM TC 2006JJ00) (DIM GC LD02)))));hoeveel recreatieterrein was er per inwoner in 2006 in oost-nederland
147;(VALUE (70072ned (MSR A045820_1 (WHERE (DIM TC 2006JJ00)))));hoeveel hectare landbouwgrond was er in 2006
148;(VALUE (70072ned (MSR 2012657_2 (WHERE (DIM TC 1999JJ00) (DIM GC PV28)))));aantal migranten met een niet westerese achtergrond in zuid holland in 1999
149;(VALUE (70072ned (MSR M000353 (WHERE (DIM TC 2016JJ00) (DIM GC PV22)))));hoeveel inwoners had de provincie drenthe in 2016
149;(VALUE (70072ned (MSR M000353 (WHERE (DIM TC 2016JJ00) (DIM GC PV22)))));hoeveel inwoners had drenthe in 2016
150;(VALUE (70072ned (MSR 70400_2 (WHERE (DIM TC 2008JJ00) (DIM GC NL01)))));hoeveel 10 tot 15 jarigen waren er in 2008 in Nederland
