qid;sexp;query
7022gza17;(VALUE (7022gza (MSR 1020_2 (WHERE (DIM Geslacht T001038) (DIM TC 1981JJ00)))));totaal gehuwde overledenen door zelfdoding in 1981
7022gza17;(VALUE (7022gza (MSR 1020_2 (WHERE (DIM Geslacht T001038) (DIM TC 1981JJ00)))));zelfmoord onder gehuwden in 1981
7022gza17;(VALUE (7022gza (MSR 1020_2 (WHERE (DIM Geslacht T001038) (DIM TC 1981JJ00)))));zelfdoding onder getrouwden in 1981
7022gza17;(VALUE (7022gza (MSR 1020_2 (WHERE (DIM Geslacht T001038) (DIM TC 1981JJ00)))));overlijdens onder getrouwden in 1981
7022gza19;(VALUE (7022gza (MSR D005130 (WHERE (DIM TC 1956JJ00) (DIM Geslacht T001038) (DIM Leeftijd 60800)))));zelfdoding door verdrinking in 1956 
7022gza19;(VALUE (7022gza (MSR D005130 (WHERE (DIM TC 1956JJ00) (DIM Geslacht T001038) (DIM Leeftijd 60800)))));zelfmoord door verdrinking in 1956 door bejaarden
7022gza19;(VALUE (7022gza (MSR D005130 (WHERE (DIM TC 1956JJ00) (DIM Geslacht T001038) (DIM Leeftijd 60800)))));hoeveel bejaarden verdronken er opzettelijk in 1956
70936ned1;(VALUE (70936ned (MSR M000239 (WHERE (DIM TC 2022MM05)))));inflatie mei 2022
70936ned1;(VALUE (70936ned (MSR M000239 (WHERE (DIM TC 2022MM05)))));cpi mei 2022
70936ned1;(VALUE (70936ned (MSR M000239 (WHERE (DIM TC 2022MM05)))));consumentenprijzen mei 2022
70936ned1;(VALUE (70936ned (MSR M000239 (WHERE (DIM TC 2022MM05)))));consumentenprijsindex mei 2022
70936ned1;(VALUE (70936ned (MSR M000239 (WHERE (DIM TC 2022MM05)))));inflatie voorjaar 2022
70936ned1;(VALUE (70936ned (MSR M000239 (WHERE (DIM TC 2022MM05)))));jaarmutatie prijzen
7123slac5;(VALUE (7123slac (MSR M003388 (WHERE (DIM Slachtdieren A048701)))));hoeveel kalveren zijn er geslacht
7123slac5;(VALUE (7123slac (MSR M003388 (WHERE (DIM Slachtdieren A048701)))));aantal geslachte kalveren
7123slac5;(VALUE (7123slac (MSR M003388 (WHERE (DIM Slachtdieren A048701)))));aantal geslachte kalfjes
7123slac6;(VALUE (7123slac (MSR M003257 (WHERE (DIM Slachtdieren A028999)))));aantal slachtingen kuikens
7123slac6;(VALUE (7123slac (MSR M003257 (WHERE (DIM Slachtdieren A028999)))));aantal geslachte kuikentjes
71450ned0;(VALUE (71450ned (MSR M005515 (WHERE (DIM TC 2014SJ00) (DIM Geslacht T001038) (DIM GC SG17) (DIM Leeftijd 10000) (DIM Migratieachtergrond 2012655)))));westerse leerlingen in Tilburg 2014/15
71450ned0;(VALUE (71450ned (MSR M005515 (WHERE (DIM TC 2014SJ00) (DIM Geslacht T001038) (DIM GC SG17) (DIM Leeftijd 10000) (DIM Migratieachtergrond 2012655)))));aantal leerlingen Tilburg 2014
71450ned0;(VALUE (71450ned (MSR M005515 (WHERE (DIM TC 2014SJ00) (DIM Geslacht T001038) (DIM GC SG17) (DIM Leeftijd 10000) (DIM Migratieachtergrond 2012655)))));studenten in Tilburg 2014/15 met westerse achtergrond
71450ned0;(VALUE (71450ned (MSR M005515 (WHERE (DIM TC 2014SJ00) (DIM Geslacht T001038) (DIM GC SG17) (DIM Leeftijd 10000) (DIM Migratieachtergrond 2012655)))));studenten Tilburg 2014
71450ned1;(VALUE (71450ned (MSR M005515 (WHERE (DIM GC GM0307)))));aantal studenten in Amersfoort
71450ned1;(VALUE (71450ned (MSR M005515 (WHERE (DIM GC GM0307)))));aantal leerlingen in Amersfoort
71450ned2;(VALUE (71450ned (MSR M005515 (WHERE (DIM Onderwijssoort T001345) (DIM GC GM0975) (DIM Migratieachtergrond H008766) (DIM TC 2003SJ00) (DIM Geslacht T001038)))));aantal leerlingen voortgezet onderwijs in Swalmen met Turkse achtergrond in 2003
71450ned4;(VALUE (71450ned (MSR M005515 (WHERE (DIM GC GM0362)))));aantal studenten in Amstelveen
80072ned0;(VALUE (80072ned (MSR M001924 (WHERE (DIM TC 2021KW03)))));ziekteverzuim 3e kwartaal 2021
80072ned0;(VALUE (80072ned (MSR M001924 (WHERE (DIM TC 2021KW03)))));verzuim door ziekte 2021 3e kwartaal
80072ned0;(VALUE (80072ned (MSR M001924 (WHERE (DIM TC 2021KW03)))));percentage zieken derde kwartaal
80072ned1;(VALUE (80072ned (MSR M001924 (WHERE (DIM BedrijfskenmerkenSBI2008 300013)))));ziekteverzuim dienstverlening
80072ned1;(VALUE (80072ned (MSR M001924 (WHERE (DIM BedrijfskenmerkenSBI2008 300013)))));ziekmeldingen in de dienstverlening
80072ned1;(VALUE (80072ned (MSR M001924 (WHERE (DIM BedrijfskenmerkenSBI2008 300013)))));percentage verzuim door ziekte dienstensector
80072ned2;(VALUE (80072ned (MSR M001924 (WHERE (DIM BedrijfskenmerkenSBI2008 WP19098)))));ziekteverzuim naar bedrijfsgrootte
80072ned2;(VALUE (80072ned (MSR M001924 (WHERE (DIM BedrijfskenmerkenSBI2008 WP19098)))));percentage ziekmeldingen grote bedrijven
80072ned2;(VALUE (80072ned (MSR M001924 (WHERE (DIM BedrijfskenmerkenSBI2008 WP19098)))));verzuim naar hoeveelheid personeel
80416ned0;(VALUE (80416ned (MSR A047220 (WHERE (DIM TC 20150505)))));literprijzen benzine op 5 mei 2015
80416ned1;(VALUE (80416ned (MSR A047219 (WHERE (DIM TC 20221019)))));dieselprijs woensdag 19 oktober 2022
80444ned4;(VALUE (80444ned (MSR M005436 (WHERE (DIM TC 2015JJ00)))));looncomponent kosten nieuwbouw 2015
80444ned4;(VALUE (80444ned (MSR M005436 (WHERE (DIM TC 2015JJ00)))));loonkosten bouwindex 
03759ned26;(VALUE (03759ned (MSR M000352 (WHERE (DIM GC GM0105)))));Wat is de bevolking van Anloo
03759ned28;(VALUE (03759ned (MSR M000352 (WHERE (DIM Geslacht T001038)))));Wat is de totale bevolking
80590ned5;(VALUE (80590ned (MSR M005036 (WHERE (DIM TC 2016MM03)))));aantal personen dat deelneemt aan de arbeidsmarkt maart 2016
82900NED4;(VALUE (82900NED (MSR T001258 (WHERE (DIM TC 2022JJ00) (DIM GC GM1641)))));wat is de voorraad woningen in maasgouw in 2022
82900NED4;(VALUE (82900NED (MSR T001258 (WHERE (DIM TC 2022JJ00) (DIM GC GM1641)))));hoeveel huizen totaal in Maasgouw in 2022
82900NED5;(VALUE (82900NED (MSR A028867_2 (WHERE (DIM GC GM0164) (DIM TC 2014JJ00)))));Wat is het totaal aantal huurwoningen van hengelo in 2014?
03759ned29;(VALUE (03759ned (MSR M000365 (WHERE (DIM Geslacht T001038) (DIM GC GM0762) (DIM Leeftijd 10000) (DIM BurgerlijkeStaat 1010) (DIM TC 2003JJ00)))));hoeveel inwoners waren er in 2003 in Deurne ongetrouwd
03759ned29;(VALUE (03759ned (MSR M000365 (WHERE (DIM Geslacht T001038) (DIM GC GM0762) (DIM Leeftijd 10000) (DIM BurgerlijkeStaat 1010) (DIM TC 2003JJ00)))));aantal mensen 2003 Deurne niet getrouwd
03759ned29;(VALUE (03759ned (MSR M000365 (WHERE (DIM Geslacht T001038) (DIM GC GM0762) (DIM Leeftijd 10000) (DIM BurgerlijkeStaat 1010) (DIM TC 2003JJ00)))));aantal ongehuwde personen in Deurne in 2003
03759ned30;(VALUE (03759ned (MSR M000365 (WHERE (DIM TC 2019JJ00) (DIM GC CR11) (DIM BurgerlijkeStaat T001019)))));hoeveel mensen waren er in 2019 in Zuidwest-Overijssel
03759ned30;(VALUE (03759ned (MSR M000365 (WHERE (DIM TC 2019JJ00) (DIM GC CR11) (DIM BurgerlijkeStaat T001019)))));inwoners Zuidwest-Overijssel 2019
03759ned34;(VALUE (03759ned (MSR M000352 (WHERE (DIM Leeftijd 10000) (DIM TC 1999JJ00) (DIM GC GM0692) (DIM Geslacht T001038)))));hoeveel inwoners had Oostburg in 1999
03759ned34;(VALUE (03759ned (MSR M000352 (WHERE (DIM Leeftijd 10000) (DIM TC 1999JJ00) (DIM GC GM0692) (DIM Geslacht T001038)))));hoeveel mensen woonden er in Oostburg in 1999
03759ned34;(VALUE (03759ned (MSR M000352 (WHERE (DIM Leeftijd 10000) (DIM TC 1999JJ00) (DIM GC GM0692) (DIM Geslacht T001038)))));aantal personen Oostburg in 1999
03759ned34;(VALUE (03759ned (MSR M000352 (WHERE (DIM Leeftijd 10000) (DIM TC 1999JJ00) (DIM GC GM0692) (DIM Geslacht T001038)))));bevolking Oostburg 1999
03759ned37;(VALUE (03759ned (MSR M000365 (WHERE (DIM Leeftijd 10000) (DIM BurgerlijkeStaat T001019) (DIM GC GM0629) (DIM TC 2007JJ00)))));aantal inwoners Wassenaar 2007
03759ned37;(VALUE (03759ned (MSR M000365 (WHERE (DIM Leeftijd 10000) (DIM BurgerlijkeStaat T001019) (DIM GC GM0629) (DIM TC 2007JJ00)))));hoeveel inwoners had Wassenaar in 2007
03759ned37;(VALUE (03759ned (MSR M000365 (WHERE (DIM Leeftijd 10000) (DIM BurgerlijkeStaat T001019) (DIM GC GM0629) (DIM TC 2007JJ00)))));hoeveel mensen woonden er in Wassenaar in 2007
03759ned37;(VALUE (03759ned (MSR M000365 (WHERE (DIM Leeftijd 10000) (DIM BurgerlijkeStaat T001019) (DIM GC GM0629) (DIM TC 2007JJ00)))));aantal personen Wassenaar in 2007
03759ned37;(VALUE (03759ned (MSR M000365 (WHERE (DIM Leeftijd 10000) (DIM BurgerlijkeStaat T001019) (DIM GC GM0629) (DIM TC 2007JJ00)))));bevolking Wassenaar 2007
37230ned24;(VALUE (37230ned (MSR M000167 (WHERE (DIM GC PV23) (DIM TC 2002JJ00)))));aantal immigranten in Overijssel in 2002
37230ned24;(VALUE (37230ned (MSR M000167 (WHERE (DIM GC PV23) (DIM TC 2002JJ00)))));hoeveel mensen hebben zich gevestigd in Overijssel in 2002
37230ned24;(VALUE (37230ned (MSR M000167 (WHERE (DIM GC PV23) (DIM TC 2002JJ00)))));immigratie Overijssel 2002
37230ned24;(VALUE (37230ned (MSR M000167 (WHERE (DIM GC PV23) (DIM TC 2002JJ00)))));aantal mensen uit het buitenland in Overijssel in 2002
37230ned25;(VALUE (37230ned (MSR M000134 (WHERE (DIM GC LD02) (DIM TC 2019MM01)))));hoeveel overledenen waren er in Oost-Nederland in januari 2019
37230ned25;(VALUE (37230ned (MSR M000134 (WHERE (DIM GC LD02) (DIM TC 2019MM01)))));aantal mensen overleden Oost-Nederland in januari 2019
37230ned25;(VALUE (37230ned (MSR M000134 (WHERE (DIM GC LD02) (DIM TC 2019MM01)))));hoeveel personen zijn overleden in Oost-Nederland in januari 2019
37230ned29;(VALUE (37230ned (MSR M000101_3 (WHERE (DIM TC 2010MM04) (DIM GC PV29)))));hoeveel mensen zijn er relatief bijgekomen in Zeeland in april 2010
37230ned29;(VALUE (37230ned (MSR M000101_3 (WHERE (DIM TC 2010MM04) (DIM GC PV29)))));relatief hoeveel is de bevolking gegroeid in Zeeland in april 2010
03759ned31;(VALUE (03759ned (MSR M000352 (WHERE (DIM GC GM1690) (DIM TC 2022JJ00) (DIM Leeftijd 10000) (DIM Geslacht T001038)))));hoeveel mensen woonden er in de wolden in 2022
03759ned31;(VALUE (03759ned (MSR M000352 (WHERE (DIM GC GM1690) (DIM TC 2022JJ00) (DIM Leeftijd 10000) (DIM Geslacht T001038)))));hoeveel inwoners had de wolden in 2022
37230ned30;(VALUE (37230ned (MSR M000099 (WHERE (DIM GC PV22)))));Hoeveel inwoners heeft Drenthe
37230ned30;(VALUE (37230ned (MSR M000099 (WHERE (DIM GC PV22)))));aantal mensen in Drenthe
37230ned30;(VALUE (37230ned (MSR M000099 (WHERE (DIM GC PV22)))));bevolking van Drenthe
37230ned30;(VALUE (37230ned (MSR M000099 (WHERE (DIM GC PV22)))));hoeveel mensen wonen in Drenthe
37230ned30;(VALUE (37230ned (MSR M000099 (WHERE (DIM GC PV22)))));aantal personen in Drenthe
7123slac29;(VALUE (7123slac (MSR M003257 (WHERE (DIM TC 2009MM06) (DIM Slachtdieren A028975)))));wat is het geslacht gewicht van koeien in juni 2009
7123slac29;(VALUE (7123slac (MSR M003257 (WHERE (DIM TC 2009MM06) (DIM Slachtdieren A028975)))));koeien, geslacht gewicht in juni 2009
7123slac30;(VALUE (7123slac (MSR M003257 (WHERE (DIM Slachtdieren A028975)))));geslacht gewicht van slachtkoeien
7123slac30;(VALUE (7123slac (MSR M003257 (WHERE (DIM Slachtdieren A028975)))));slachtkoeien, geslacht gewicht
7123slac30;(VALUE (7123slac (MSR M003257 (WHERE (DIM Slachtdieren A028975)))));totaal geslacht gewicht van slachtkoeien
7123slac33;(VALUE (7123slac (MSR M003388 (WHERE (DIM TC 2002MM10) (DIM Slachtdieren A048698)))));aantal geslachte vaarzen in oktober 2002
7123slac34;(VALUE (7123slac (MSR M003257 (WHERE (DIM Slachtdieren A029002)))));geslacht gewicht, overig pluimvee
7123slac34;(VALUE (7123slac (MSR M003257 (WHERE (DIM Slachtdieren A029002)))));totaal geslacht gewicht van overig pluimvee
7123slac35;(VALUE (7123slac (MSR M003257 (WHERE (DIM TC 2016MM09) (DIM Slachtdieren A028999)))));geslacht gewicht van vleeskuikens in september 2016
7123slac36;(VALUE (7123slac (MSR M003257 (WHERE (DIM Slachtdieren A028984)))));geslacht gewicht van schapen en lammeren 
7123slac36;(VALUE (7123slac (MSR M003257 (WHERE (DIM Slachtdieren A028984)))));geslacht gewicht van slachtdieren, schapen en lammeren
7123slac37;(VALUE (7123slac (MSR M003388 (WHERE (DIM TC 2011MM06) (DIM Slachtdieren A048697)))));aantal geslachte kalveren jonger dan 9 maanden in juni 2011
7123slac37;(VALUE (7123slac (MSR M003388 (WHERE (DIM TC 2011MM06) (DIM Slachtdieren A048697)))));slachtingen van jonge kalveren in juni 2011
7123slac38;(VALUE (7123slac (MSR M003388 (WHERE (DIM TC 2003JJ00)))));aantal slachtingen in de 2003
7123slac38;(VALUE (7123slac (MSR M003388 (WHERE (DIM TC 2003JJ00)))));hoeveel dieren zijn er geslacht in 2003
7123slac38;(VALUE (7123slac (MSR M003388 (WHERE (DIM TC 2003JJ00)))));geslachte dieren per jaar
7123slac39;(VALUE (7123slac (MSR M003388 (WHERE (DIM TC 2013MM12) (DIM Slachtdieren A048696)))));aantal slachtingen van schapenlammeren in december 2013
71450ned11;(VALUE (71450ned (MSR M005515 (WHERE (DIM Onderwijssoort T001345) (DIM GC GM0431) (DIM Geslacht T001038) (DIM Leeftijd 10000) (DIM TC 2015SJ00)))));aantal leerlingen op het voortgezet onderwijs in Oostzaan in de periode 2015/16
71450ned11;(VALUE (71450ned (MSR M005515 (WHERE (DIM Onderwijssoort T001345) (DIM GC GM0431) (DIM Geslacht T001038) (DIM Leeftijd 10000) (DIM TC 2015SJ00)))));aantal studenten op het voortgezet onderwijs in Oostzaan in 2015/16
82900NED1;(VALUE (82900NED (MSR A047047 (WHERE (DIM StatusVanBewoning A028725)))));bewoonde huurwoningen in eigendom corporatie 
82900NED1;(VALUE (82900NED (MSR A047047 (WHERE (DIM StatusVanBewoning A028725)))));aantal huizen van woningcorporatie in gebruik
82900NED2;(VALUE (82900NED (MSR T001258 (WHERE (DIM GC GM0606)))));totaal aantal woningen schiedam 
82900NED3;(VALUE (82900NED (MSR T001258 (WHERE (DIM StatusVanBewoning A028725) (DIM GC GM0450)))));aantal bewoonde woningen uitgeest
82900NED3;(VALUE (82900NED (MSR T001258 (WHERE (DIM StatusVanBewoning A028725) (DIM GC GM0450)))));woningvoorraad bewoond uitgeest
80590ned3;(VALUE (80590ned (MSR D006394 (WHERE (DIM Leeftijd 53310) (DIM Geslacht 4000)))));hoeveel vrouwen van 30 jaar werken niet
03759ned32;(VALUE (03759ned (MSR M000352 (WHERE (DIM GC GM0335) (DIM TC 2022JJ00) (DIM Leeftijd 10000) (DIM BurgerlijkeStaat T001019) (DIM Geslacht T001038)))));aantal inwoners Montfoort 2022
03759ned32;(VALUE (03759ned (MSR M000352 (WHERE (DIM GC GM0335) (DIM TC 2022JJ00) (DIM Leeftijd 10000) (DIM BurgerlijkeStaat T001019) (DIM Geslacht T001038)))));hoeveel inwoners had Montfoort in 2022
03759ned32;(VALUE (03759ned (MSR M000352 (WHERE (DIM GC GM0335) (DIM TC 2022JJ00) (DIM Leeftijd 10000) (DIM BurgerlijkeStaat T001019) (DIM Geslacht T001038)))));aantal personen Montfoort in 2022
03759ned39;(VALUE (03759ned (MSR M000365 (WHERE (DIM GC GM0376) (DIM TC 2004JJ00) (DIM Geslacht T001038) (DIM Leeftijd 10000)))));gemiddelde bevolking Blaricum 2004
37230ned27;(VALUE (37230ned (MSR M000102_1 (WHERE (DIM GC PV30)))));hoeveel mensen zijn erbij gekomen in Noord-Brabant
37230ned27;(VALUE (37230ned (MSR M000102_1 (WHERE (DIM GC PV30)))));met hoeveel personen is Noord-Brabant gegroeid
37230ned27;(VALUE (37230ned (MSR M000102_1 (WHERE (DIM GC PV30)))));hoeveel inwoners zijn er in Noord-Brabant sinds januari bijgekomen
03759ned33;(VALUE (03759ned (MSR M000365 (WHERE (DIM TC 2008JJ00) (DIM Geslacht T001038)))));Hoeveel mensen waren er in 2008?
03759ned33;(VALUE (03759ned (MSR M000365 (WHERE (DIM TC 2008JJ00) (DIM Geslacht T001038)))));Hoeveel mannen en vrouwen waren er in 2008?
03759ned35;(VALUE (03759ned (MSR M000352 (WHERE (DIM TC 2013JJ00) (DIM Geslacht T001038)))));hoe groot was de bevolking van nederland in 2013
7022gza20;(VALUE (7022gza (MSR 1020_1 (WHERE (DIM Leeftijd 60300) (DIM TC 1983JJ00)))));hoeveel getrouwde mensen van 20 jaar hebben zelfmoord gepleegd in 1983
7022gza20;(VALUE (7022gza (MSR 1020_1 (WHERE (DIM Leeftijd 60300) (DIM TC 1983JJ00)))));suïcide gehuwde personen van 25 jaar in 1983
7022gza20;(VALUE (7022gza (MSR 1020_1 (WHERE (DIM Leeftijd 60300) (DIM TC 1983JJ00)))));zelfdoding getrouwde personen van 29 jaar in 1983
7022gza20;(VALUE (7022gza (MSR 1020_1 (WHERE (DIM Leeftijd 60300) (DIM TC 1983JJ00)))));aantal mensen met een geregistreerd partnerschap van 27 jaar dat zelfmoord heeft gepleegd in 1983
7022gza21;(VALUE (7022gza (MSR D005130 (WHERE (DIM TC 1990JJ00) (DIM Leeftijd 21700)))));hoeveel mensen van 80 jaar of ouder hebben zichzelf verdronken in 1990
7022gza21;(VALUE (7022gza (MSR D005130 (WHERE (DIM TC 1990JJ00) (DIM Leeftijd 21700)))));personen >80 jaar omgekomen door zichzelf te verdrinken in 1990
7022gza21;(VALUE (7022gza (MSR D005130 (WHERE (DIM TC 1990JJ00) (DIM Leeftijd 21700)))));aantal mensen van 100 jaar dat zichzelf verdronken heeft in 1990
7022gza21;(VALUE (7022gza (MSR D005130 (WHERE (DIM TC 1990JJ00) (DIM Leeftijd 21700)))));zelfmoord door verdrinking onder 90-jarigen in 1990
7022gza23;(VALUE (7022gza (MSR D005030 (WHERE (DIM TC 1969JJ00) (DIM Geslacht 3000)))));hoeveel mannen hebben zelfmoord gepleegd in 1969 vanwege lichamelijke beperking
7022gza23;(VALUE (7022gza (MSR D005030 (WHERE (DIM TC 1969JJ00) (DIM Geslacht 3000)))));aantal suïcides onder mannen in 1969 met fysieke stoornis
37360ned1;(VALUE (37360ned (MSR M001183 (WHERE (DIM LeeftijdOp31December 15400)))));Hoeveel mensen zijn 54
37360ned1;(VALUE (37360ned (MSR M001183 (WHERE (DIM LeeftijdOp31December 15400)))));Hoeveel 54-jarigen zijn er
37360ned1;(VALUE (37360ned (MSR M001183 (WHERE (DIM LeeftijdOp31December 15400)))));hoeveel mensen worden dit jaar 54
7022gza22;(VALUE (7022gza (MSR D004458 (WHERE (DIM TC 1959JJ00) (DIM Leeftijd 60400) (DIM Geslacht 4000)))));Hoeveel vrouwen tussen de 30 en 40 jaar pleegden in 1959 zelfmoord
7022gza22;(VALUE (7022gza (MSR D004458 (WHERE (DIM TC 1959JJ00) (DIM Leeftijd 60400) (DIM Geslacht 4000)))));Hoeveel zelfdodingen waren er onder vrouwen tussen de 30 en 40 jaar in 1959
7022gza22;(VALUE (7022gza (MSR D004458 (WHERE (DIM TC 1959JJ00) (DIM Leeftijd 60400) (DIM Geslacht 4000)))));zelfmoord vrouwen 34 jaar 1959
7022gza22;(VALUE (7022gza (MSR D004458 (WHERE (DIM TC 1959JJ00) (DIM Leeftijd 60400) (DIM Geslacht 4000)))));zelfdoding vrouwen 30-40 jaar 1959
7022gza24;(VALUE (7022gza (MSR D005060 (WHERE (DIM Leeftijd 60600)))));hoeveel mensen van 50 tot 60 jaar namen een overdosis medicijnen
7022gza24;(VALUE (7022gza (MSR D005060 (WHERE (DIM Leeftijd 60600)))));hoeveel zelfdodingen met medicijnen of alcohol waren er onder vijftigers
7022gza24;(VALUE (7022gza (MSR D005060 (WHERE (DIM Leeftijd 60600)))));hoeveel zelfmoorden met medicijnen of alcohol waren er onder vijftigers
7022gza24;(VALUE (7022gza (MSR D005060 (WHERE (DIM Leeftijd 60600)))));hoeveel zelfdodingen met medicijnen of alcohol waren er onder mensen tussen de 50 en 60 jaar
7022gza24;(VALUE (7022gza (MSR D005060 (WHERE (DIM Leeftijd 60600)))));hoeveel mensen tussen de 50 en 60 jaar dronken zich dood
7022gza24;(VALUE (7022gza (MSR D005060 (WHERE (DIM Leeftijd 60600)))));hoeveel vijftigers dronken zich dood
7022gza24;(VALUE (7022gza (MSR D005060 (WHERE (DIM Leeftijd 60600)))));overdosis medicijnen 50-60 jaar
03759ned38;(VALUE (03759ned (MSR M000352 (WHERE (DIM BurgerlijkeStaat T001019) (DIM Leeftijd 10000) (DIM TC 1990JJ00)))));bevolking in 1990
03759ned38;(VALUE (03759ned (MSR M000352 (WHERE (DIM BurgerlijkeStaat T001019) (DIM Leeftijd 10000) (DIM TC 1990JJ00)))));totaal aantal mensen in 1990
03759ned38;(VALUE (03759ned (MSR M000352 (WHERE (DIM BurgerlijkeStaat T001019) (DIM Leeftijd 10000) (DIM TC 1990JJ00)))));aantal personen in 1990
71450ned12;(VALUE (71450ned (MSR M005515 (WHERE (DIM GC GM0479) (DIM TC 2010SJ00) (DIM Leeftijd 10000) (DIM Onderwijssoort T001345) (DIM Migratieachtergrond 1012600) (DIM Geslacht T001038)))));totaal aantal leerlingen met Nederlandse migratieachtergrond op het voortgezet onderwijs in Zaanstad in het schooljaar 2010/11
71450ned13;(VALUE (71450ned (MSR M005515 (WHERE (DIM Leeftijd 10000) (DIM Migratieachtergrond H008766) (DIM GC GM0381) (DIM TC 2005SJ00) (DIM Onderwijssoort T001345)))));aantal studenten met Turkse migratieachtergrond op het voortgezet onderwijs in Bussum in 2005/06
71450ned13;(VALUE (71450ned (MSR M005515 (WHERE (DIM Leeftijd 10000) (DIM Migratieachtergrond H008766) (DIM GC GM0381) (DIM TC 2005SJ00) (DIM Onderwijssoort T001345)))));leerlingen op het voortgezet onderwijs met Turkse achtergrond in Bussum in het jaar 2005/06
71450ned14;(VALUE (71450ned (MSR M005515 (WHERE (DIM Onderwijssoort T001345) (DIM Geslacht T001038) (DIM Leeftijd 10000) (DIM TC 2006SJ00)))));totaal aantal leerlingen op het voortgezet onderwijs in het jaar 2006
71450ned15;(VALUE (71450ned (MSR M005515 (WHERE (DIM Geslacht T001038) (DIM Migratieachtergrond 2012655)))));totaal aantal leerlingen met westerse achtergrond 
71450ned15;(VALUE (71450ned (MSR M005515 (WHERE (DIM Geslacht T001038) (DIM Migratieachtergrond 2012655)))));totaal aantal studenten met westerse migratieachtergrond 
71450ned35;(VALUE (71450ned (MSR M005515 (WHERE (DIM GC SG15) (DIM Geslacht T001038) (DIM TC 2010SJ00) (DIM Onderwijssoort T001345)))));studenten in Dordrecht op het voortgezet onderwijs in 2010
71450ned35;(VALUE (71450ned (MSR M005515 (WHERE (DIM GC SG15) (DIM Geslacht T001038) (DIM TC 2010SJ00) (DIM Onderwijssoort T001345)))));leerlingen op het vo in Dordrecht in 2010/11
71450ned36;(VALUE (71450ned (MSR M005515 (WHERE (DIM TC 2004SJ00)))));aantal studenten/leerlingen in het schooljaar 2004/'05
80416ned11;(VALUE (80416ned (MSR A047221 (WHERE (DIM TC 20060407)))));prijs lpg op vrijdag 7 april 2006
80416ned12;(VALUE (80416ned (MSR A047221 (WHERE (DIM TC 20140825)))));pompprijs lpg op 25 augustus
84672NED12;(VALUE (84672NED (MSR A045057_2 (WHERE (DIM Btw A048944) (DIM TC 2018JJ00)))));Wat was de energiebelasting in 2018 inclusief btw
81309NED38;(VALUE (81309NED (MSR D001525 (WHERE (DIM Belastingen A047660)))));Wat was de prijs van elektriciteit exclusief btw en inclusief belastingen
81238ned27;(VALUE (81238ned (MSR M002658 (WHERE (DIM BedrijfstakkenBranchesSBI2008 307500) (DIM TC 2013MM09) (DIM GC LD01)))));Wat is de verwachte stijging in orders in de industrie in Noord-Nederland voor september 2013?
83913NED33;(VALUE (83913NED (MSR M001505_2 (WHERE (DIM GC GM0344) (DIM TC 2017KW01)))));prijsindex koopwoningen 2017 per kwartaal
83913NED33;(VALUE (83913NED (MSR M001505_2 (WHERE (DIM GC GM0344) (DIM TC 2017KW01)))));prijs bestaande koopwoningen utrecht begin 2017
84538NED7;(VALUE (84538NED (MSR M005356 (WHERE (DIM Deelgebieden A023267) (DIM TC 2023MM01)))));gww inputprijsindex januari 2023
84538NED7;(VALUE (84538NED (MSR M005356 (WHERE (DIM Deelgebieden A023267) (DIM TC 2023MM01)))));bouwrijp maken van terreinen prijzen per maand
84672NED35;(VALUE (84672NED (MSR A045057_1 (WHERE (DIM Btw A048945) (DIM TC 2021MM04)))));wat was de belasting op energie in april 2021
84672NED38;(VALUE (84672NED (MSR M000176_1 (WHERE (DIM Btw A048945) (DIM TC 2019MM06)))));variabel leveringstarief aardgas in juni 2019
84672NED39;(VALUE (84672NED (MSR M001013_1 (WHERE (DIM TC 2020MM06) (DIM Btw A048944)))));transporttarief aardgas in juni 2020
85168NED0;(VALUE (85168NED (MSR D000198 (WHERE (DIM TypeArbeidsongeschiktheidsuitkering A048565)))));aantal wao uitkeringen
85168NED0;(VALUE (85168NED (MSR D000198 (WHERE (DIM TypeArbeidsongeschiktheidsuitkering A048565)))));Hoeveel arbeidsongeschiktheidsuitkeringen
85422NED6;(VALUE (85422NED (MSR A050297 (WHERE (DIM Vooropleiding T001230) (DIM Opleidingsfase A028673) (DIM TC 2015SJ00) (DIM Geslacht 3000) (DIM Onderwijssoort A025297)))));Hoeveel mannelijke eerstejaars wo studenten in 2015 
85422NED6;(VALUE (85422NED (MSR A050297 (WHERE (DIM Vooropleiding T001230) (DIM Opleidingsfase A028673) (DIM TC 2015SJ00) (DIM Geslacht 3000) (DIM Onderwijssoort A025297)))));welk aantal eerstejaars in het wetenschappelijk onderwijs is man schooljaar 2015
85489NED14;(VALUE (85489NED (MSR M005527 (WHERE (DIM Regiokenmerken GM0000) (DIM Onderwijssoort A025279) (DIM Geslacht T001038) (DIM TC 2015SJ00) (DIM GeboortelandOuders T001638) (DIM Herkomstland T001040)))));hoeveel leerlingen in basisonderwijs in 2015 2016
84672NED5;(VALUE (84672NED (MSR M001284 (WHERE (DIM TC 2018MM12) (DIM Btw A048945)))));wat is het gemiddelde energietarief voor consumenten exclusief btw in december 2018
84672NED5;(VALUE (84672NED (MSR M001284 (WHERE (DIM TC 2018MM12) (DIM Btw A048945)))));wat was de prijs voor elektriciteit in december 2018 exclusief btw
84672NED23;(VALUE (84672NED (MSR M001013_1 (WHERE (DIM TC 2021MM08) (DIM Btw A048944)))));wat was het transporttarief voor aardgas inclusief btw in augustus 2021
85511NED16;(VALUE (85511NED (MSR 53055 (WHERE (DIM Onderwijsvolgend T001144)))));Hoeveel jongeren volgen onderwijs
85511NED19;(VALUE (85511NED (MSR 53055 (WHERE (DIM Arbeidskenmerken T001095) (DIM Uitkering A045274) (DIM TC 2020JJ00) (DIM GeregistreerdWerkzoekendeBijUWV A050097)))));hoeveel jongeren krijgen een uitkering in 2020
84287NED16;(VALUE (84287NED (MSR M002042 (WHERE (DIM TC 2012MM12) (DIM BedrijfstakkenBranchesSBI2008 307500)))));vacature indicator industrie december 2012
84287NED35;(VALUE (84287NED (MSR M002042 (WHERE (DIM TC 2008MM03)))));vacature indicator totaal maart 2008
81589NED19;(VALUE (81589NED (MSR WP19089 (WHERE (DIM TC 2023KW02)))));aantal bedrijven in het tweede kwartaal 2023, met 10 tot 20 werkzame personen
03759ned36;(VALUE (03759ned (MSR M000352 (WHERE (DIM TC 2002JJ00) (DIM Leeftijd 10000) (DIM BurgerlijkeStaat T001019)))));bevolking in 2002
03759ned36;(VALUE (03759ned (MSR M000352 (WHERE (DIM TC 2002JJ00) (DIM Leeftijd 10000) (DIM BurgerlijkeStaat T001019)))));aantal mensen in 2002
03759ned36;(VALUE (03759ned (MSR M000352 (WHERE (DIM TC 2002JJ00) (DIM Leeftijd 10000) (DIM BurgerlijkeStaat T001019)))));totale bevolking in 2002
37360ned9;(VALUE (37360ned (MSR M005112 (WHERE (DIM LeeftijdOp31December 17400)))));levensverwachting 70 plussers
37360ned9;(VALUE (37360ned (MSR M005112 (WHERE (DIM LeeftijdOp31December 17400)))));sterftekans 70 plussers
70936ned2;(VALUE (70936ned (MSR M000239 (WHERE (DIM TC 1994MM08)))));prijsindexcijfer augustus 1994
70936ned2;(VALUE (70936ned (MSR M000239 (WHERE (DIM TC 1994MM08)))));inflatie augustus 1994
70936ned2;(VALUE (70936ned (MSR M000239 (WHERE (DIM TC 1994MM08)))));jaarmutatie inflatie 1994
70936ned3;(VALUE (70936ned (MSR M000238 (WHERE (DIM TC 1972JJ00)))));cpi 1972
70936ned3;(VALUE (70936ned (MSR M000238 (WHERE (DIM TC 1972JJ00)))));jaarinflatie 1972
70936ned3;(VALUE (70936ned (MSR M000238 (WHERE (DIM TC 1972JJ00)))));wat was de in inflatie 1972
